<?xml version="1.0" encoding="UTF-8" standalone="no"?>
<KNACKS lang="en" xmlns="http://earthdawn.com/knack" xmlns:xsi="http://www.w3.org/2001/XMLSchema-instance" xsi:schemaLocation="http://earthdawn.com/knack ../../earthdawnknacks.xsd">
	<KNACK name="Backlash"            strain="2"  bookref="NG p.224"><BASE type="talent" minrank="6"  name="Tail Dance"/>                                </KNACK>
	<KNACK name="Beauty of Bloodshed" strain="4"  bookref="NG p.224"><BASE type="talent" minrank="7"  name="Thread Weaving" limitation="Art Weaving"/>   </KNACK>
	<KNACK name="Bluffing Dive"       strain="2"  bookref="NG p.224"><BASE type="talent" minrank="9"  name="Dive Attack"/>                               </KNACK>
	<KNACK name="Body Armor"          strain="1"  bookref="NG p.224"><BASE type="talent" minrank="9"  name="Body Control"/>                              </KNACK>
	<KNACK name="Brandmark Servant"   strain="2"  bookref="NG p.224"><BASE type="talent" minrank="7"  name="Detect Influence"/>                          </KNACK>
	<KNACK name="Break Lock"          strain="2"  bookref="NG p.225"><BASE type="talent" minrank="6"  name="Lock Picking"/>                              </KNACK>
	<KNACK name="Broadside"           strain="4"  bookref="NG p.225"><BASE type="talent" minrank="8"  name="Pilot Boat"/>                                </KNACK>
	<KNACK name="Clay Blend"          strain="2+" bookref="NG p.225"><BASE type="talent" minrank="8"  name="Clay Skin"/>                                 </KNACK>
	<KNACK name="Collective Beating"  strain="1+" bookref="NG p.225"><BASE type="talent" minrank="9"  name="Hoard Blows"/>                               </KNACK>
	<KNACK name="Cover"               strain="1"  bookref="NG p.225"><BASE type="talent" minrank="6"  name="Avoid Blow"/>                                </KNACK>
	<KNACK name="Dive"                strain="2"  bookref="NG p.225"><BASE type="talent" minrank="8"  name="Swimming"/>                                  </KNACK>
	<KNACK name="Dragging Parry"      strain="2"  bookref="NG p.225"><BASE type="talent" minrank="8"  name="Cast Net"/>                                  </KNACK>
	<KNACK name="Endure Heat"         strain="0"  bookref="NG p.226"><BASE type="talent" minrank="5"  name="Endure Cold"/>                               </KNACK>
	<KNACK name="Fake Thought"        strain="2"  bookref="NG p.226"><BASE type="talent" minrank="9"  name="Safe Thought"/>                              </KNACK>
	<KNACK name="Fast Grab"           strain="2"  bookref="NG p.226"><BASE type="talent" minrank="9"  name="Disarm"/>                                    </KNACK>
	<KNACK name="Fast Talk"           strain="2"  bookref="NG p.226"><BASE type="talent" minrank="6"  name="Conversation"/>                              </KNACK>
	<KNACK name="Hiking"              strain="3"  bookref="NG p.226"><BASE type="talent" minrank="9"  name="Woodwalk"/>                                  </KNACK>
	<KNACK name="History Skit"        strain="4"  bookref="NG p.226"><BASE type="talent" minrank="11" name="Truth Skit"/>                                </KNACK>
	<KNACK name="Hoard Spells"        strain="1"  bookref="NG p.226"><BASE type="talent" minrank="9"  name="Hoard Blows"/>                               </KNACK>
	<KNACK name="Hoarded Haunting"    strain="2+" bookref="NG p.226"><BASE type="talent" minrank="8"  name="Hoard Blows"/>                               </KNACK>
	<KNACK name="Incite Monologue"    strain="3"  bookref="NG p.226"><BASE type="talent" minrank="7"  name="Engaging Banter"/>                           </KNACK>
	<KNACK name="Lasting Performance" strain="2"  bookref="NG p.226"><BASE type="talent" minrank="9"  name="Performance"/>                               </KNACK>
	<KNACK name="Lay of the Land"     strain="1"  bookref="NG p.226"><BASE type="talent" minrank="5"  name="Lifesight"/>                                 </KNACK>
	<KNACK name="Locate Horror"       strain="4"  bookref="NG p.226"><BASE type="talent" minrank="7"  name="Bear Mark"/>                                 </KNACK>
	<KNACK name="Mind Reading"        strain="1"  bookref="NG p.227"><BASE type="talent" minrank="11" name="Lip Reading"/>                               </KNACK>
	<KNACK name="Mystic Mind Armor"   strain="2"  bookref="NG p.227"><BASE type="talent" minrank="8"  name="Mind Armor"/>                                </KNACK>
	<KNACK name="Scorn"               strain="2"  bookref="NG p.227"><BASE type="talent" minrank="7"  name="Performance"/>                               </KNACK>
	<KNACK name="Tail Sweep"          strain="2"  bookref="NG p.227"><BASE type="talent" minrank="9"  name="Unarmed Combat"/>                            </KNACK>
	<KNACK name="Threatening Aura"    strain="2"  bookref="NG p.227"><BASE type="talent" minrank="9"  name="Power Mask"/>                                </KNACK>
	<KNACK name="Treetrap"            strain="2"  bookref="NG p.227"><BASE type="talent" minrank="7"  name="Thread Weaving" limitation="Forest Weaving"/></KNACK>
	<KNACK name="Wind Shout"          strain="2"  bookref="NG p.227"><BASE type="talent" minrank="7"  name="Wind Dance"/>                                </KNACK>
	<KNACK name="Wood Wings"          strain="1"  bookref="NG p.227"><BASE type="talent" minrank="6"  name="Wood Skin"/>                                 </KNACK>
</KNACKS>
